{
  "scenario_id": "A2_recipient_does_not_acknowledge",
  "violation_id": "v001",
  "violated_obligation": "Contract operator 'acknowledgment' must be satisfied",
  "trigger": {
    "event_id": "e005",
    "time": 5.45,
    "description": "acknowledgment at 5.45s"
  },
  "expected": {
    "event": "human_1_user_acknowledges_delivery",
    "time_window": ""
  },
  "observed": {
    "event": null,
    "description": "No human_1_user_acknowledges_delivery observed before deadline"
  },
  "falsification": {
    "time": 31.66,
    "description": "Violation detected at 31.66s — human_1_user_acknowledges_delivery not satisfied"
  },
  "attribution": "human_1",
  "site": "closure",
  "evidence_window": {
    "start": 4.95,
    "end": 32.66,
    "events": [
      {
        "event_id": "e004",
        "timestamp": 4.95,
        "event_type": "speaking_start",
        "agent": "human_1",
        "details": "speaking_start"
      },
      {
        "event_id": "e005",
        "timestamp": 5.45,
        "event_type": "robot_announces_delivery",
        "agent": "robot_1",
        "details": "robot_announces_delivery"
      },
      {
        "event_id": "e006",
        "timestamp": 6.83,
        "event_type": "speaking_end",
        "agent": "human_1",
        "details": "speaking_end"
      },
      {
        "event_id": "e007",
        "timestamp": 7.04,
        "event_type": "speaking_start",
        "agent": "human_1",
        "details": "speaking_start"
      },
      {
        "event_id": "e008",
        "timestamp": 8.88,
        "event_type": "speaking_end",
        "agent": "human_1",
        "details": "speaking_end"
      },
      {
        "event_id": "e009",
        "timestamp": 9.08,
        "event_type": "speaking_start",
        "agent": "human_1",
        "details": "speaking_start"
      },
      {
        "event_id": "e010",
        "timestamp": 10.91,
        "event_type": "speaking_end",
        "agent": "human_1",
        "details": "speaking_end"
      },
      {
        "event_id": "e011",
        "timestamp": 11.11,
        "event_type": "speaking_start",
        "agent": "human_1",
        "details": "speaking_start"
      },
      {
        "event_id": "e012",
        "timestamp": 13.04,
        "event_type": "speaking_end",
        "agent": "human_1",
        "details": "speaking_end"
      },
      {
        "event_id": "e013",
        "timestamp": 13.25,
        "event_type": "speaking_start",
        "agent": "human_1",
        "details": "speaking_start"
      },
      {
        "event_id": "e014",
        "timestamp": 15.07,
        "event_type": "speaking_end",
        "agent": "human_1",
        "details": "speaking_end"
      },
      {
        "event_id": "e015",
        "timestamp": 15.27,
        "event_type": "speaking_start",
        "agent": "human_1",
        "details": "speaking_start"
      },
      {
        "event_id": "e016",
        "timestamp": 17.13,
        "event_type": "speaking_end",
        "agent": "human_1",
        "details": "speaking_end"
      },
      {
        "event_id": "e017",
        "timestamp": 17.33,
        "event_type": "speaking_start",
        "agent": "human_1",
        "details": "speaking_start"
      },
      {
        "event_id": "e018",
        "timestamp": 19.18,
        "event_type": "speaking_end",
        "agent": "human_1",
        "details": "speaking_end"
      },
      {
        "event_id": "e019",
        "timestamp": 19.39,
        "event_type": "speaking_start",
        "agent": "human_1",
        "details": "speaking_start"
      },
      {
        "event_id": "e020",
        "timestamp": 21.22,
        "event_type": "speaking_end",
        "agent": "human_1",
        "details": "speaking_end"
      },
      {
        "event_id": "e021",
        "timestamp": 21.43,
        "event_type": "speaking_start",
        "agent": "human_1",
        "details": "speaking_start"
      },
      {
        "event_id": "e022",
        "timestamp": 23.28,
        "event_type": "speaking_end",
        "agent": "human_1",
        "details": "speaking_end"
      },
      {
        "event_id": "e023",
        "timestamp": 23.48,
        "event_type": "speaking_start",
        "agent": "human_1",
        "details": "speaking_start"
      },
      {
        "event_id": "e024",
        "timestamp": 25.31,
        "event_type": "speaking_end",
        "agent": "human_1",
        "details": "speaking_end"
      },
      {
        "event_id": "e025",
        "timestamp": 25.51,
        "event_type": "speaking_start",
        "agent": "human_1",
        "details": "speaking_start"
      },
      {
        "event_id": "e026",
        "timestamp": 27.37,
        "event_type": "speaking_end",
        "agent": "human_1",
        "details": "speaking_end"
      },
      {
        "event_id": "e027",
        "timestamp": 27.58,
        "event_type": "speaking_start",
        "agent": "human_1",
        "details": "speaking_start"
      },
      {
        "event_id": "e028",
        "timestamp": 29.42,
        "event_type": "speaking_end",
        "agent": "human_1",
        "details": "speaking_end"
      },
      {
        "event_id": "e029",
        "timestamp": 29.62,
        "event_type": "speaking_start",
        "agent": "human_1",
        "details": "speaking_start"
      },
      {
        "event_id": "e030",
        "timestamp": 31.46,
        "event_type": "speaking_end",
        "agent": "human_1",
        "details": "speaking_end"
      },
      {
        "event_id": "e031",
        "timestamp": 31.66,
        "event_type": "speaking_start",
        "agent": "human_1",
        "details": "speaking_start"
      }
    ]
  }
}